{"$schema":"https://json-schema.org/draft/2020-12/schema","additionalProperties":true,"properties":{"commands":{"items":{"additionalProperties":true,"properties":{"category":{"type":"string"},"entry":{"type":"string"},"feature_flag":{"type":["string","null"]},"name":{"type":"string"},"notes":{"type":["string","null"]},"requires_certification":{"type":"boolean"},"requires_work_id":{"type":"boolean"},"summary":{"type":"string"}},"required":["name","entry","summary","category","requires_certification","requires_work_id","feature_flag","notes"],"type":"object"},"type":"array"},"generated_at":{"type":["string","null"]},"schema_version":{"minimum":1,"type":"integer"},"updated_at":{"type":["string","null"]}},"required":["schema_version","updated_at","generated_at","commands"],"title":"command_registry","type":"object"}
